{
 "meta": {
  "title": "Discovery: Control: ezmode",
  "status": "draft",
  "date": "2026-10-06",
  "author": "sd-stories",
  "intent": "01a11327-eadb-7e02-b6bc-eb3ece0533bf",
  "rounds": 3
 },
 "sources": [
  {
   "name": "GitHub issue trackers (REST search via gh api, full threads via the issues and comments endpoints)",
   "sampled": 20,
   "defects": [
    "sample 'crash modpack' (20 issues): 20/20 on topic, but 17/20 Minecraft, so the source skews to Minecraft modpacks over Bethesda heavy setups",
    "logs offloaded to external pastes (mclo.gs, gist, pastebin, gnomebot, p.kdan.dev) in 9/20; pastes can expire, so the data a report carried may no longer be reachable",
    "forced issue templates leave '_No response_' fields in 6/20; the player's own words are often one line inside a template",
    "1/20 author shown as 'ghost' (deleted account)",
    "5/20 dated before 2023; older reports describe tool versions since replaced",
    "2026 issues increasingly carry AI-written analyses and some repos are written by AI agents end to end (seen in roughly 1 in 10 Skyrim crash issues read and in most 'nexus api' results); only the person's own lines are cited",
    "one tracker per repo; counted here as one family (GitHub issue trackers) so that several repos never make a second family"
   ]
  },
  {
   "name": "Hacker News (Algolia search API and Firebase item API, read through WebFetch)",
   "sampled": 20,
   "defects": [
    "sample 'mod crash' comments (20): 4/20 on game mods; 16/20 off topic (hardware mods, cars, browsers)",
    "story titles sometimes '[dead]'; one hit was a pasted Nexus announcement (context, not evidence)",
    "comment tree fetches (items endpoint) are truncated by the fetch tool, so a fetch that reports no matching comments is not evidence of silence; such searches are marked unreliable in the trails",
    "dates are per comment and reliable; text verified through the Firebase item endpoint"
   ]
  },
  {
   "name": "Lemmy/threadiverse (lemmy.world search API, per-comment API on the origin instance)",
   "sampled": 20,
   "defects": [
    "sample 'modding discord' comments (20): 6/20 use 'modding' to mean moderating",
    "instances die: lemmyonline.com no longer serves comments (lemmy.world copies used), lemmy.one returned 522, kbin.social is gone",
    "'guilded' searches return mostly 'gilded age' misspellings (18/20 off topic)",
    "search results read through a summarizing model truncate content; every cited comment was re-fetched from the per-comment endpoint"
   ]
  },
  {
   "name": "Steam Community discussions (read through WebFetch)",
   "sampled": 3,
   "defects": [
    "three threads read (about 25 posts); two fetches returned only the page chrome (Skyrim app 72850 threads) so the Skyrim forum stayed out of reach",
    "the fetch tool summarizes posts; one first-hand passage was re-fetched for exact text",
    "most replies in the sampled threads were advice or second-hand recollection rather than first-hand accounts"
   ]
  },
  {
   "name": "STEP Modifications forum (read through WebFetch)",
   "sampled": 2,
   "defects": [
    "two threads read (16 posts); search pages not fetched, threads found through web search",
    "the fetch tool invented a post: its first summary of thread 20025 gave z929669 a Sept 23 reply ('Perhaps. Maybe report it on that mod page') that the string-check showed is not on the page; every STEP quote cited was string-checked",
    "logs linked off-site"
   ]
  },
  {
   "name": "Roblox DevForum (Discourse JSON, read through WebFetch)",
   "sampled": 2,
   "defects": [
    "two topics read (about 24 posts of 223); only the first page of the 221-post announcement topic was reached",
    "voices are Roblox creators who used Guilded, not modding groups",
    "many posts are one-line farewells without an experience"
   ]
  },
  {
   "name": "EndeavourOS forum (Discourse JSON)",
   "sampled": 1,
   "defects": [
    "one topic, 7 posts; a Linux project community, not a modding group"
   ]
  },
  {
   "name": "General web search (WebSearch)",
   "sampled": 12,
   "defects": [
    "returns a model summary plus links; summaries were used only to find places, never cited",
    "many hits are SEO or AI-written pages (Discord-alternative listicles, 'how much does CurseForge pay' explainers); none cited",
    "press articles quote authors (Arthmoor, 2021) second-hand; kept as context"
   ]
  },
  {
   "name": "WebFetch path (all non-GitHub pages)",
   "sampled": 0,
   "defects": [
    "passes pages through a small model that paraphrases, inserts ellipses, and once invented a post; every cited quote from this path was either fetched from a per-item API in exact form or string-checked in a second fetch"
   ]
  },
  {
   "name": "Reddit (r/skyrimmods, r/feedthebeast and others)",
   "sampled": 0,
   "defects": [
    "unreachable: WebFetch is refused for reddit.com, redlib/libreddit mirrors returned 403 or TLS errors, arctic-shift returned 422, and a direct network fetch needs the operator's approval; the largest player and author community is therefore absent from this record"
   ]
  },
  {
   "name": "Nexus Mods site and forums",
   "sampled": 0,
   "defects": [
    "unreachable: every page returned 403; mod-page posts tabs, author About pages and the 2021 announcement comments are absent"
   ]
  },
  {
   "name": "Discord servers",
   "sampled": 0,
   "defects": [
    "not searchable from outside; the place where much mod support now happens (see Q14) is invisible to this record"
   ]
  },
  {
   "name": "eavesdrop corpus",
   "sampled": 0,
   "defects": [
    "not used: under refactor and not trustworthy as of 2026-10-05 (threaded replies misattributed), per the run instructions"
   ]
  }
 ],
 "questions": [
  {
   "id": "Q1",
   "round": 1,
   "kind": "people",
   "raised_by": "current_state.real[0]",
   "question": "When a heavily modded game crashes, what do players do next, and how do they work out whether it is just them?",
   "places": [
    {
     "name": "GitHub issue trackers (mod, modpack and mod-tool repos)",
     "url": "https://github.com/search?type=issues",
     "in_lens": false
    },
    {
     "name": "STEP Modifications forum",
     "url": "https://stepmodifications.org/forum/",
     "in_lens": false
    },
    {
     "name": "Hacker News",
     "url": "https://news.ycombinator.com/",
     "in_lens": false
    },
    {
     "name": "r/skyrimmods",
     "url": "https://www.reddit.com/r/skyrimmods/",
     "in_lens": false
    },
    {
     "name": "r/feedthebeast",
     "url": "https://www.reddit.com/r/feedthebeast/",
     "in_lens": false
    },
    {
     "name": "Nexus Mods forums",
     "url": "https://forums.nexusmods.com/",
     "in_lens": false
    }
   ],
   "trail": {
    "searches": [
     "GitHub issues: '\"no idea why\" crash mod is:issue' (20 read)",
     "GitHub issues: 'crash log skyrim CTD is:issue' (15 read)",
     "GitHub issues: '\"just me\" crash mod is:issue' (20 read)",
     "GitHub issues: 'repo:wabbajack-tools/wabbajack crash game is:issue' (15 read)",
     "GitHub issues: 'crash modpack' source sample (20 read)",
     "web: 'stepmodifications.org forum CTD crash log \"I have no idea\"' then 2 STEP threads read in full",
     "HN Algolia: 'mod crash' comments (20 read)",
     "opposite direction, GitHub: '\"that fixed it\" crash mod in:comments created:>2025-06-01' (15 titles, 3 threads read): found crashes that went away fast once an author or upstream shipped an update (C82), which bears on Q5, not on what players do first",
     "Reddit r/skyrimmods: unreachable"
    ],
    "read": 128,
    "on_question": 26
   },
   "evidence": [
    "C1",
    "C2",
    "C4",
    "C5",
    "C7",
    "C10",
    "C11",
    "C16",
    "C32",
    "C33",
    "C34",
    "C38",
    "C53",
    "C57",
    "C61",
    "C91"
   ],
   "contradicting": [],
   "status": "answered",
   "few_voices": false,
   "expert_only": false,
   "authors": 13,
   "families": 3,
   "family_names": [
    "GitHub issue trackers",
    "Hacker News",
    "STEP Modifications forum"
   ],
   "answer": "as of 2026-10-06: Players work it out alone first. They switch mods off one by one or back out what they just added (C1, C2, C57, C61), search the crash text for someone else's post (C33), or hand the log to an AI (C4, C57). Most cannot read the log themselves (C7, C32). They suspect their own setup and apologise for asking (C2, C53). It costs them hours or a whole evening (C10, C38). Finding another person's report of the same crash brings relief: 'so it's not just me, that's good' (C10). No first-hand account found says the first move was different.",
   "spawned": [
    "Q15",
    "Q16",
    "Q17"
   ]
  },
  {
   "id": "Q2",
   "round": 1,
   "kind": "people",
   "raised_by": "actors[0].stakes",
   "question": "Where do players take a crash for help, and what happens when they show it to someone?",
   "places": [
    {
     "name": "GitHub issue trackers (mod, modpack and mod-tool repos)",
     "url": "https://github.com/search?type=issues",
     "in_lens": false
    },
    {
     "name": "STEP Modifications forum",
     "url": "https://stepmodifications.org/forum/",
     "in_lens": false
    },
    {
     "name": "Lemmy/threadiverse",
     "url": "https://lemmy.world/",
     "in_lens": false
    },
    {
     "name": "r/skyrimmods",
     "url": "https://www.reddit.com/r/skyrimmods/",
     "in_lens": false
    },
    {
     "name": "Nexus Mods forums",
     "url": "https://forums.nexusmods.com/",
     "in_lens": false
    }
   ],
   "trail": {
    "searches": [
     "GitHub issues: threads read in full (Wabbajack #2627, Seb263 #80, Fuzss #166, Lucis #8, VFXEditor #338, Unicopia #602)",
     "GitHub issues: '\"can't help without\" log crash mod in:comments' (6 read)",
     "GitHub issues: '\"need the crash log\" mod in:comments' (20 titles, 4 threads read)",
     "STEP forum: 2 threads read in full",
     "Lemmy: 'modding discord' comments (20 read)",